author,title,description,content,date
Walter Thompson,"Corporate, public investments spur interest in Pacific Northwest startups","Why are businesses and government organizations investing so much into the the strip of land down the West Coast from Vancouver, Canada to Portland, Oregon ","Cities have always been Americas centers of power, driving the economy forward through competition. But now, theyre ceasing to lead the countrys innovation. As jobs and talent have clustered, expertise has spilled over urban boundaries. In locations like the 6407 chars ",2019-11-07T22:50:09Z
Christopher Clarey,Spain Beats Canada to Win Davis Cup at Home,"Rafael Nadal helped the Spaniards defeat Canada, 2 0, to win the cup in its much discussed new format.","But Nadal faced down plenty of challenges, including 4 30 a.m. bedtimes after late finishing matches. Its always difficult to speak about Rafa, Lpez said. To be honest, there are things that you cannot describe with words, because the things that he was abl 1482 chars ",2019-11-25T00:07:43Z
Mihir Zaveri,7 Killed in Plane Crash in Ontario,The authorities in Canada said they were still investigating what caused the plane to crash on Wednesday.,"Seven people were killed when a small plane crashed north of Kingston, Ontario, on Wednesday evening, the authorities in Canada said. It was not immediately clear what caused the plane, a Piper PA 32, to crash after 5 p.m. The wreckage was found in a heavily 445 chars ",2019-11-29T01:25:31Z
Saavon Smalls,"Disney ranks No. 1 in App Store in U.S., Canada","Occurring just a day after the app launched, Disney now has at least 10 million accounts subscribed. Read more... More about Tech, Mashable Video, Streaming Service, Tiktok, and Disney",nan,2019-11-14T20:05:59Z
Darrell Etherington,"The Samsung Galaxy Fold is headed to Canada, with in store pre orders starting today","The Samsung Galaxy Fold is a very unique smartphone, in more ways than one. The most obvious differentiator is that it folds out to expose a large, continuous 7.3 display, hiding the seam thanks to a flexible OLED screen. Its also at the very top end of the","The Samsung Galaxy Fold is a very unique smartphone, in more ways than one. The most obvious differentiator is that it folds out to expose a large, continuous 7.3 display, hiding the seam thanks to a flexible OLED screen. Its also at the very top end of the 1731 chars ",2019-11-28T14:37:53Z
Annie Karni,"In Video, World Leaders Seem to Be Commiserating About Trump","The leaders of Canada, France and Britain did not appear to realize that their conversation at a Buckingham Palace reception was being recorded.","Mr. Trump was put on the defensive Tuesday by Mr. Macron, who during a tense 45 minute appearance aggressively challenged the American presidents vision for NATO and his handling of a military conflict involving Turkey. For Mr. Trump, it was a rare face to fa 880 chars ",2019-12-04T05:22:07Z
"Paul P. Murphy, CNN",The aurora borealis will be visible in parts of the US tonight,"Thanks to a minor geomagnetic storm, the northern lights may be visible in parts of the northern United States and across Canada on Wednesday night."," CNN Thanks to a minor geomagnetic storm, the northern lights may be visible in parts of the northern United States and across Canada on Wednesday night. According to NOAA's Space Weather Prediction Center, an explosion of solar energy from the sun is set to 766 chars ",2019-11-20T15:34:10Z
Greg Kumparak,"Disney will launch in the UK, Germany, Italy, France, and Spain in March 2020","Disney will launch in the US, Canada, and the Netherlands on November 12th, a bit shy of a week from today. On November 19th, itll expand to Australia and New Zealand. But what about the rest of the world Disney has kept a bit quiet about its plans for oth","Disney will launch in the US, Canada, and the Netherlands on November 12th, a bit shy of a week from today. On November 19th, itll expand to Australia and New Zealand. But what about the rest of the world Disney has kept a bit quiet about its plans for o 994 chars ",2019-11-08T00:38:52Z
Frederic Lardinois,Microsofts HoloLens 2 starts shipping,"Earlier this year, at Mobile World Congress in Barcelona, Microsoft announced the second generation of its HoloLens augmented reality visor. Today, the 3,500 HoloLens 2 is going on sale in the United States, Japan, China, Germany, Canada, United Kingdom, Ire","Earlier this year, at Mobile World Congress in Barcelona, Microsoft announced the second generation of its HoloLens augmented reality visor. Today, the 3,500 HoloLens 2 is going on sale in the United States, Japan, China, Germany, Canada, United Kingdom, Ire 1739 chars ",2019-11-07T13:00:49Z
Anthony Ha,"Disney officially launches its streaming crown jewel, Disney ","The centerpiece of Disneys streaming strategy is here. After an initial test in the Netherlands, Disney is officially launching in the United States and Canada today, with a lineup of original content that includes the first episode of the very first live a","The centerpiece of Disneys streaming strategy is here. After an initial test in the Netherlands, Disney is officially launching in the United States and Canada today, with a lineup of original content that includes the first episode of the very first live a 5086 chars ",2019-11-12T08:00:06Z
J.M. Donaldson,Extra Crunch members get free Zendesk for 6 months,"Were excited to announce a new Extra Crunch community perk from Zendesk. Starting today, annual and 2 year Extra Crunch members that are new to Zendesk and located within the US or Canada can receive a credit for six months of unlimited licenses for any comb","Were excited to announce a new Extra Crunch community perk from Zendesk. Starting today, annual and 2 year Extra Crunch members that are new to Zendesk and located within the US or Canada can receive a credit for six months of unlimited licenses for any combi 3156 chars ",2019-11-13T21:14:47Z
,Emotional Bautista Agut wins in Davis Cup three days after father dies,Roberto Bautista Agut puts  canada education Spain 1 0 ahead in their Davis Cup final against Canada with an emotional victory over Felix Auger Aliassime in Madrid.,"Roberto Bautista Agut spoke through tears after his victory, which came three days after the death of his father Roberto Bautista Agut put Spain 1 0 ahead in their Davis Cup final against Canada with an emotional victory over Felix Auger Aliassime in Madrid. 1463 chars ",2019-11-24T18:07:17Z
Darrell Etherington,Portag3 Ventures closes 320 million second fund focused on fintech investment,"Canadian venture capital firm Portag3 Ventures has closed a second fund focused on investing in fintech startup, with final commitments from institutional and strategic LPs totally 427 million CAD around 320 million USD . The fund will before costing on ea","Canadian venture capital firm Portag3 Ventures has closed a second fund focused on investing in fintech startup, with final commitments from institutional and strategic LPs totally 427 million CAD around 320 million USD . The fund will before costing on ea 2130 chars ",2019-12-03T09:00:38Z
Georgina Torbet,DoJ charges 14 people in 6 million counterfeit iPhone and iPad scheme,"Scammers are continuing to cause problems for Apple, submitting counterfeit iPhones under warranty and getting them replaced with genuine devices. The US Department of Justice recently unsealed a federal grand jury indictment against a China based group which","In raids on two businesses and several homes in Mira Mesa and Mission Hills, California, officials seized 250,000 in cash as well as 90 iPhones, which are being analyzed for fake parts. Three brothers, Zhiwei Loop Liao, Zhimin Liao and Zhiting Liao, are alle 1451 chars ",2019-11-14T13:31:00Z
Ed Cara,Canadian Therapist Gives Up License After Satanists Expose Her 'Mind Control' Talks,"Activists with The Satanic Temple say a now former therapist in Canada has been pushing conspiracies about globe spanning, mind controlling cults for years. And after they exposed some of her professional talks to her licensing board, she voluntarily gave up ","Activists with The Satanic Temple say a now former therapist in Canada has been pushing conspiracies about globe spanning, mind controlling cults for years. And after they exposed some of her professional talks to her licensing board, she voluntarily gave up 11388 chars ",2019-11-05T18:10:00Z
Rhett Jones,Why Are People Suddenly Getting Mysterious Text Messages ,"Early Thursday morning, people all over the U.S. and Canada began receiving strange text messages that didnt make a whole lot of sense. The texts were from people they knew but they lacked context and appeared to have been sent months ago. And it really frea","Early Thursday morning, people all over the U.S. and Canada began receiving strange text messages that didnt make a whole lot of sense. The texts were from people they knew but they lacked context and appeared to have been sent months ago. And it really freak 4010 chars ",2019-11-07T22:46:00Z
Jared DiPane,Best Canada Black Friday Deals in 2019,"Black Friday may not be here yet, but the deals are already flowing. We will be rounding up all of our favorites right here throughout the next week, so be sure to keep an eye on this page for new deals as they become available. Newest Deals Amazon Devices TV","Black Friday may not be here yet, but the deals are already flowing. We will be rounding up all of our favorites right here throughout the next week, so be sure to keep an eye on this page for new deals as they become available. This year's top picks Last y 1807 chars ",2019-11-27T12:00:00Z
Pelmorex Weather Networks Inc,WINTER FORECAST Much of Canada in for a 'harsh' season ahead The Weather Network,"WINTER FORECAST Much of Canada in for a 'harsh' season ahead The Weather Network Cold, stormy winter forecast across much of Canada CTV News Cold, stormy winter across much of Canada seasonal forecast 680 News Cold, stormy winter forecast for much of Canada","Your weather when it really mattersTM Please choose your default site Monday, November 18th 2019, 6 00 am The wild and historic winter like weather that's impacted parts of the country this fall looks to provide us with hints of what the upcoming winter 5260 chars ",2019-11-18T11:00:00Z
David Friend,Disney Plus streaming service arrives in Canada with technical hurdles CTV News,Disney Plus streaming service arrives in Canada with technical hurdles CTV News Disney Plus Arrives In Canada Amid Onslaught Of New Streaming Services HuffPost Canada Disney Plus gives Canadians a streaming platform that nearly matches U.S. version Yahoo Cana,"TORONTO Disney Plus has arrived in Canada, becoming the newest player in the growing menu of TV options, but some users say they've encountered technical problems trying to access the streaming platform. A number of Canadians took to social media on Tuesd 2422 chars ",2019-11-12T16:37:00Z
Christine Fisher,Sony brings AirPlay 2 and HomeKit to more high end TVs,"Earlier this year, Sony announced that some of its higher end TVs would add support for Apple's AirPlay 2 and HomeKit protocols. Now, Sony is bringing that support to more TVs. According to MacRumors, the update is available on the 2018 A9F and Z9F models, as","According to MacRumors, the update is available on the 2018 A9F and Z9F models, as well as the 2019 A9G, Z9G, X950G and X850G TVs, in the US, Canada and Latin America. AirPlay 2 will allow users to stream content directly from their iPhone, iPad or Mac, and 357 chars ",2019-12-03T17:32:00Z
Ryan McKenna,Canadas historic Davis Cup run continues with title now in reach Sportsnet.ca,Canadas historic Davis Cup run continues with title now in reach Sportsnet.ca Canada advances to Davis Cup final after beating Russia 2 1 Global News Davis Cup Finals 2019 Canada books first ever championship appearance with win against Russia Sporting News,"One hundred and six years. Thats how long it took Canada to break its drought and reach the Davis Cup final, achieved by Denis Shapovalov and Vasek Pospisil on Saturday after defeating Russia 2 1 in semifinal action in Madrid. The Canadian duo got past Rus 5348 chars ",2019-11-23T17:57:00Z
The Canadian Press,Canada's Felix Auger Aliassime sidelined for Davis Cup opener TSN,"Canada's Felix Auger Aliassime sidelined for Davis Cup opener TSN Shapovalov, Pospisil give Canada a pair of upsets over Italy at Davis Cup Sportsnet.ca Denis Shapovalov, Vasek Pospisil give Canada Davis Cup win over favoured Italy The Globe and Mail Davis Cu","MADRID Denis Shapovalov and Vasek Pospisil kept rolling on Monday, notching a pair of upsets to lead Canada to a win over Italy on the opening day of the inaugural Davis Cup Finals. Shapovalov, ranked 15th in the world, gave Canada an insurmountable 2 0 lead 4087 chars ",2019-11-18T14:56:22Z
Anna Johansson,Should Startups Consider Doing Business in Canada ,"Our neighbor to the north presents unique, often untapped growth opportunities for entrepreneurs.","December 2, 2019 5 min read Opinions expressed by Entrepreneur contributors are their own. If youre thinking about starting a new business or expanding your current enterprise, you might consider operating in Canada. The requirements to enter Canada have 4981 chars ",2019-12-02T17:30:00Z
Reuters Editorial,"Canada, Netherlands back NATO rethink after French, U.S. doubts","The prime ministers of Canada and the Netherlands added their support on Tuesday to a Franco German proposal to reform NATO, after France's president said the Western alliance was dying.","LONDON Reuters The prime ministers of Canada and the Netherlands added their support on Tuesday to a Franco German proposal to reform NATO, after Frances president said the Western alliance was dying. I dont think you survive 70 years as an alliance 451 chars ",2019-12-03T14:54:03Z
Marc DeAngelis,"Lyft expands Grocery Access Program to Baltimore, Chicago and NYC","This spring, Lyft announced its Grocery Access Program, which provided low income families in select cities a flat rate ride to the grocery store. The company's goal is to make healthy food more widely available, charging an average of 2.50 per ride to partn","Approximately 23.5 million people in the US live in food deserts areas that lack affordable and healthy food according to Lyft, and 2.5 million live in low income, rural areas that are more than 10 miles from a supermarket. So far, the company has provi 470 chars ",2019-11-20T19:13:00Z
Mara Gay,Bloomberg Apologizes for Stop and Frisk at Just the Right Time,"Money cant buy the good will of a crucial Democratic constituency, black voters, ahead of likely presidential bid.","The data Mr. Bloomberg is so fond of ultimately showed otherwise. In 88 percent of the stops, there was no arrest. In 2013, a federal judge ruled that the administrations use of the tactic was unconstitutional. Stops declined sharply in his final years in off 1560 chars ",2019-11-17T17:34:26Z
Jared DiPane,These are the best Cyber Monday 2019 deals in Canada ,"Cyber Monday is almost here Most Canadian retailers have updated their prices for Cyber Monday, and you can get some incredible deals in Canada, from retailers like Best Buy, Amazon, Walmart and others. Best Cyber Monday deals in Canada Fire TV Stick 4K with","Cyber Monday is almost here Most Canadian retailers have updated their prices for Cyber Monday, and you can get some incredible deals in Canada, from retailers like Best Buy, Amazon, Walmart and others. Best Cyber Monday deals in Canada ul li Fire TV Sti 4369 chars ",2019-11-30T22:25:27Z
CIC News,"Employment rose in B.C. and Newfoundland last month, new Labour Force Survey shows Canada Immigration News","Employment rose in B.C. and Newfoundland last month, new Labour Force Survey shows Canada Immigration News Canada unexpectedly loses 1,800 jobs, widely missing forecasts Financial Post Unemployment rates remain high in Calgary and Edmonton CTV News Canadian d","British Columbia and Newfoundland led Canadas provinces in employment gains in October, Statistics Canadas new Labour Force Survey reports. Canada added 443,000 new jobs in the 12 months spanning October 2018 to October 2019, led by gains in full time work 2464 chars ",2019-11-08T20:24:00Z
ericaalini,Disney Plus Apple TV Plus Heres how major streaming video services in Canada compare Global News,Disney Plus Apple TV Plus Heres how major streaming video services in Canada compare Global News 4 things to know about the new streaming service Disney Plus CBC.ca Is Disney Worth It A Guide to the New Streaming Service Collider.com Should you spend you,"Disney and Apples respective streaming services, Disney Plus and Apple TV Plus, have arrived in Canada with a slew of old and original content. On one hand, this is great news it means greater variety at low prices, as media giants compete for a slice of t 5439 chars ",2019-11-13T01:07:30Z
,Rate of Objects Left In Surgery Patients In Canada Found To Be Increasing 604 Now,"Rate of Objects Left In Surgery Patients In Canada Found To Be Increasing 604 Now Medical objects are being left in patients, how can it be prevented CBC News The National More foreign bodies being left behind in Canadian patients after surgery Report Ne","Between 2016 and 2018, Canadian surgeons have left more surgical items in patients than most countries. More than 550 objects were reported left inside patients, post surgery, said the Canadian Institute for Health Information study. That includes sponges, m 1829 chars ",2019-11-07T18:03:31Z
The Canadian Press,Spain ends Canada's historic run in Davis Cup final TSN,"Spain ends Canada's historic run in Davis Cup final TSN Despite Davis Cup loss, Canada proves it belongs with the sports best Sportsnet.ca Canada loses bid for its first ever Davis Cup title, falling to Spain CBC.ca Shapovalov proud of Canada's run to final ","MADRID World No. 1 Rafael Nadal defeated Denis Shapovalov 6 3, 7 6 7 on Sunday to give Spain its sixth Davis Cup title and deny Canada its first. Shapovalov of Richmond Hill, Ont., fended off a pair of championship points in the second set tiebreak before 4089 chars ",2019-11-24T20:17:12Z
Lee Berthiaume,Brain death Canada to navigate minefield as France questions NATOs future Global News,Brain death Canada to navigate minefield as France questions NATOs future Global News NATO Battle Between U.S. And France Leaves Canada Stuck In The Middle HuffPost Canada NATO ministers gather amid tensions with France CTV News Nato leader identifies spa,"A brewingbattleoverthefutureofNATOcould have major implicationsforCanada, whichfordecades has relied on the military alliance as a cornerstoneofits security, protection and influence in the world. Prime Minister Justin Trudeau is expected to tra 5016 chars ",2019-11-20T02:24:24Z
Patrick John Gilson,11 Amazon Canada Cyber Monday Deals That Will Make Christmas Shopping Easy Narcity,"11 Amazon Canada Cyber Monday Deals That Will Make Christmas Shopping Easy Narcity Black Friday and Cyber Monday may be over, but these deals are still available to shop Yahoo Style Your Amazon Prime membership scores you up to 50 off these movie rentals And","It's that time of year again, where we can save on products from the comfort of our own home. While some of us chose to brave the crowds of Black Friday, hitting up real life shopping centres in the hopes of finding the best Christmas deals, Cyber Monday also 3996 chars ",2019-12-02T20:15:00Z
Canadian Press,"CANADA 553 foreign items left in patients post surgery between 2016 and 2018, study shows GuelphToday","CANADA 553 foreign items left in patients post surgery between 2016 and 2018, study shows GuelphToday Medical objects are being left in patients, how can it be prevented CBC News The National More foreign bodies being left behind in Canadian patients after","More than 550 objects have been unintentionally left in Canadian medical and surgery patients between 2016 and 2018, and the problem appears to be getting worse. A new report released Thursday by the Canadian Institute for Health Information says 553 foreign 5133 chars ",2019-11-07T16:20:00Z
https://www.facebook.com/bbcnews,Canadian islanders angry over US mail searches,"Campobello islanders can only get their mail via the US, and now their packages are being searched.","Image copyrightPortland Press Herald via Getty ImagesImage caption Former US president Franklin Roosevelt used to holiday on Campobello Campobello, a small Canadian island on the southwestern tip of New Brunswick, is only accessible year round by bridge fr 6615 chars ",2019-12-01T01:03:07Z
BeauHD,Federal Court Approves First 'Pirate' Site Blockade In Canada,"A group of major broadcasters and telco giants, including Rogers and Bell, have obtained the first Canadian pirate site blocking order. TorrentFreak reports Last year, a coalition of copyright holders and major players in the telco industry asked the Canadia","Last year, a coalition of copyright holders and major players in the telco industry asked the Canadian Government to institute a national pirate site blocking scheme. The Fairplay coalition argued that such measures would be required to effectively curb onlin 1622 chars ",2019-11-23T00:02:00Z
Bloomberg News,Canada's economy slows even as business investment perks up BNNBloomberg.ca,Canada's economy slows even as business investment perks up BNNBloomberg.ca Canadian economy slows to 1.3 in 3rd quarter Statistics Canada Global News Real estate lifts Canada's economic growth Yahoo Canada Finance Canada's economy slows in third quarter ev,"Canadas economy slowed sharply in the third quarter, as a drop in exports and draw down in business inventories masked a rebound in domestic demand. Gross domestic product grew at an annualized pace of 1.3per cent in the three months ended September, in lin 3156 chars ",2019-11-29T13:47:50Z
,Sportsnet exploring new formats for first intermission CityNews,"Sportsnet exploring new formats for first intermission CityNews Ron MacLean addresses his Hockey Night in Canada future Yahoo Canada Sports Rex Murphy Shame on you Sportsnet. Don Cherry deserved much, much better National Post Orr calls Cherry firing 'disgra","Dont expect an immediate replacement for fired commentator Don Cherry on Coachs Corner. In fact, its possible that Sportsnet may eventually take the long running Hockey Night in Canada segment in a different direction. Were taking the time to explore ne 1962 chars ",2019-11-16T12:57:47Z
Zi-Ann Lum,Nancy Pelosi Says New NAFTA Deal Is 'Imminent' HuffPost Canada,Nancy Pelosi Says New NAFTA Deal Is 'Imminent' HuffPost Canada Nancy Pelosi says she wants to see U.S. House pass CUSMA by end of 2019 Global News Pelosi USMCA deal is imminent POLITICO Pelosi says agreement on revamped NAFTA imminent Washington Post Dem,"WASHINGTON The most powerful Democrat in the United States Congress says she believes lawmakers on Capitol Hill could vote on the new North American free trade agreement before the end of the year. Nancy Pelosi, the Speaker of the House of Representatives, 2821 chars ",2019-11-14T21:16:46Z
KamloopsBCNow,Health Canada 'actively monitoring' US vaping illness breakthrough KamloopsBCNow,Health Canada 'actively monitoring' US vaping illness breakthrough KamloopsBCNow US research links vaping related lung disease to vitamin E acetate durhamradionews.com Officials Made A Breakthrough In The Vaping Illness Cases Health Canada Is Taking Note Na,Canadian health officials say they are closely monitoring an apparent U.S. breakthrough into the cause of a mysterious vaping illness. The U.S. Centers for Disease Control and Prevention say they have a very strong culprit in a chemical compound known as v 1754 chars ,2019-11-09T19:14:32Z
"Omar Sachedina, Ben Cousins","'I'm not backing down' Cherry not apologizing, admits to poor choice of words CTV News","'I'm not backing down' Cherry not apologizing, admits to poor choice of words CTV News 'There is hypocrisy in all this' Post readers defend Don Cherry National Post Don Cherry explains what he meant by 'you people' in poppy rant Yahoo News Canada 'The probl","TORONTO A day after being fired for suggesting immigrants dont wear poppies, hockey broadcaster Don Cherry isnt apologizing, but wishes he had chosen different words to illustrate his opinion. Cherry was fired Monday, after nearly 40 years of working the 2501 chars ",2019-11-13T03:17:00Z
Daniel Tencer,Canadian Cannabis Earnings Are A Bloodbath HuffPost Canada,"Canadian Cannabis Earnings Are A Bloodbath HuffPost Canada 'Some of these guys are going to disappear' Slump hits cannabis industry CTV News Aurora expects it will beat peers to profitability, but when Yahoo Canada Finance Pot companies reel from week of bl",MONTREAL Weed may not be the product that sells itself after all. Its turning out to be a bit tricky to make a profit on the green stuff legally in Canada these days. Some of Canadas largest cannabis manufacturers have reported dismal sales and weake 4195 chars ,2019-11-15T20:33:11Z
,Remembrance Day 2019 Canada Remembers LIVE Global News,Remembrance Day 2019 Canada Remembers LIVE Global News Watch Remembrance Day at the Canadian War Museum Live video Maclean's Remembrance Day poppies dropped over Dover The Sun View full coverage on Google News, getSimpleString data.title getSimpleString data.description getSimpleString data.videoCountText ,2019-11-11T14:55:12Z
,Students say schools are not protective against abusive coaches Canada News Castanet.net,Students say schools are not protective against abusive coaches Canada News Castanet.net View full coverage on Google News,"Meredith Goldhawk has loved hockey since she was four. But she says since a coach at the University of Windsor harassed and bullied her, she can't even bring herself to play a pickup game with friends. ""Some days I will just sit down and cry because she too 4314 chars ",2019-11-24T17:41:00Z
