author,title,description,content,date
Graham Slaughter,Canada wide emergency alert system to be tested Wednesday CTV News,Canada wide emergency alert system to be tested Wednesday CTV News Emergency alert test coming to B.C. mobile phones on Wednesday Global News Province testing emergency alert system Wednesday My Comox Valley Now Quebec will test its emergency alert system on ,"TORONTO If your cellphone receives an emergency alert text on Wednesday, dont panic. Canadas national emergency alert system, Alert Ready, has scheduled a public test for later this week. Depending on where you live, the test will be sent in the late morn 1447 chars ",2019-11-25T17:18:00Z
The Canadian Press,"Surgical objects left in patients on the rise in Canada, data shows Red Deer Advocate"," p TORONTO More than 550 objects have been unintentionally left in Canadian medical and surgery patients between 2016 and 2018, and the problem appears to be getting worse. p ","TORONTO More than 550 objects have been unintentionally left in Canadian medical and surgery patients between 2016 and 2018, and the problem appears to be getting worse. A new report released Thursday by the Canadian Institute for Health Information says 5 5099 chars ",2019-11-07T22:04:00Z
Premila D'Sa,Conservatives Vote Against Power To Quickly Boot Scheer As Leader HuffPost Canada,Conservatives Vote Against Power To Quickly Boot Scheer As Leader HuffPost Canada Scheer survives critical test as Conservative MPs vote against giving themselves power to oust party leader The Globe and Mail Pressure mounts on Scheer new poll shows 42 per ,"OTTAWA Andrew Scheer emerged from a marathon caucus meeting Wednesday, declaring that Conservative MPs are united behind his leadership after they declined to give themselves the power to boot the leader out. Scheers leadership will still, however, face a 4809 chars ",2019-11-06T23:06:32Z
Ainsley Smith,Motorola's revamped razr will be available in Canada next year Venture Daily Hive,Motorola's revamped razr will be available in Canada next year Venture Daily Hive Motorola Razr vs. Galaxy Fold The foldable phone war is on CNET Motorola Razr 2019 screen repair price is surprisingly low SlashGear Hands on video of Samsungs upcoming fold,"Get ready for a blast from the past Motorolais reviving its popularrazrflip phone and it will be available in Canada starting early next year. Motorola has reinvented its beloved razr, which was wildly popular in the mid 2000s, as a smartphone with multi 1866 chars ",2019-11-18T16:11:00Z
,BRAUN Canada has left Cystic Fibrosis patients in the lurch. Herald Publicist,"Greater than 18 months in the past we wrote about Victoria Vigneau, a Canadian teenager with Cystic Fibrosis.Like different Canadians with CF, Victoria is aware","Greater than 18 months in the past we wrote about Victoria Vigneau, a Canadian teenager with Cystic Fibrosis. Like different Canadians with CF, Victoria is aware of there are medication that can save her life medication she cant get. Orkambi, a gene alteri 4383 chars ",2019-11-24T11:42:00Z
Emma Paling,Doug Ford Says He's 'So Proud' Of Green Energy Cancellations That Cost 231M HuffPost Canada,Doug Ford Says He's 'So Proud' Of Green Energy Cancellations That Cost 231M HuffPost Canada ANALYSIS Doug Ford attempts political makeover Global News Ford stresses national unity after Trudeau meeting Toronto Sun Ford presses 'critical' need for national u,"TORONTO Ontario Premier Doug Ford says 231 million to cancel green energy contracts is not a waste of taxpayers money. I am so proud of that, Ford told reporters outside his Queens Park office Thursday. They went into communities without their appr 1568 chars ",2019-11-21T16:47:43Z
,Prince Andrew's Office Has Been Moved Out of Buckingham Palace Report Yahoo News Canada,Prince Andrew's Office Has Been Moved Out of Buckingham Palace Report Yahoo News Canada Sarah Ferguson What Fergie advised Prince Andrew ahead of doomed BBC interview Express Who is Amanda Thirsk Prince Andrews private secretary who was sacked by The Quee,"In the latest news from the fallout following Prince Andrews interview concerning his ties to Jeffrey Epstein and his subsequent announcement to step down from royal duties, the Duke of Yorks office has been forced out of Buckingham Palace. Queen Elizabeths 3913 chars ",2019-11-23T00:33:52Z
,TC Energy Corp. expects annual dividend growth to slow beyond 2021 Yahoo Canada Finance,"CALGARY TC Energy Corp. is looking at ""optimizing"" unaffected parts of its Keystone pipeline and will use drag reducing agents to ease volume losses following a spill in North Dakota, Paul Miller, vice president of liquids pipelines, reported Tuesday.The pi","CALGARY TC Energy Corp. is looking at ""optimizing"" unaffected parts of its Keystone pipelineand willuse drag reducing agentsto ease volume losses following a spill in North Dakota,Paul Miller,vice president of liquids pipelines, reported Tuesday. The pi 3144 chars ",2019-11-19T13:01:00Z
,Amazon's Fire TV Stick is on sale for just 25 Yahoo News Canada,"Amazon's Fire TV Stick is on sale for just 25 Yahoo News Canada Best Buy Cyber Monday sale offers free Echo Dot with Fire TV Stick 4K What Hi Fi Don't buy an Apple TV, get a 25 Cyber Monday Amazon Fire TV Stick 4K instead iMore Amazon Fire TV Stick Hits N","Yahoo Lifestyle Canada is committed to finding you the best products at the best prices. We may receive a share from purchases made via links on this page. Looking for gifts ideas, deals and shopping hacks Check out Yahoo Canada's holiday page. Looking for 4075 chars ",2019-11-30T19:00:00Z
Amanda Connolly,Trump calls Canada slightly delinquent for not meeting NATO defence spending goals Global News,Trump calls Canada slightly delinquent for not meeting NATO defence spending goals Global News Macron rebukes Trump to his face on live television at NATO summit National Post How NATO's defence spending benchmark turned into an international PR exercise CB,"U.S. President Donald Trump says Canada is slightly delinquent compared to other NATO allies failing to meet their defence spending targets. In a media availability with Prime Minister Justin Trudeau ahead of a joint meeting on Tuesday, Trump was asked abo 5292 chars ",2019-12-03T19:30:28Z
Sinad Baker,An Air Canada Boeing 787 flying across the Atlantic was forced to turn back after its windscreen cracked in mid air,"An Air Canada Boeing 787 8 flight had to turn round mid flight after the crew spotted a crack in the windshield. Flight AC857 was due to fly from London to Toronto but was forced to land in Dublin, Ireland because of the incident. The flight had already flown",An Air Canada Boeing 787 plane that was flying across the Atlantic from London to Toronto had to land in Dublin after its windscreen cracked mid flight. Flight AC 857 had already flown past Ireland and was around one hour into the flight on Saturday when cre 1727 chars ,2019-11-26T10:23:39Z
The Canadian Press,Disney Plus streaming service arrives in Canada with a few technical hurdles CTV News,Disney Plus streaming service arrives in Canada with a few technical hurdles CTV News 4 things to know about the new streaming service Disney Plus CBC.ca Is Disney Worth It A Guide to the New Streaming Service Collider.com The Mandalorian Special Look D,"TORONTO Disney Plus has arrived in Canada, becoming the newest player in the growing menu of TV options, but some users say they've encountered technical problems trying to access the streaming platform. A number of Canadians took to social media on Tuesd 2422 chars ",2019-11-12T15:58:00Z
Josh Constine,Instagram to test hiding Like counts in the US next week,"We will make decisions that hurt the business if they help peoples well being and health says Instagrams CEO Adam Mosseri. To that end, next week Instagram will expand its test of hiding Like counts from everyone but a posts creator to the United States.","We will make decisions that hurt the business if they help peoples well being and health says Instagrams CEO Adam Mosseri. To that end, next week Instagram will expand its test of hiding Like counts from everyone but a posts creator to the United States. 1670 chars ",2019-11-09T00:25:57Z
,Protesters attempt to flee Hong Kong university,Police have called on protesters to resign after they occupied the campus of Hong Kong Polytechnic University. CNN's Anna Coren reports.,Chat with us in Facebook Messenger. Find out what's happening in the world as it unfolds.,2019-11-20T21:46:00Z
Luis Ferr-Sadurn,Syracuse University Suspends Fraternity Activities After Racist Incident,"On Saturday, a group of students accosted an African American student, using a racial slur. It was the latest in a rash of racist and anti Semitic incidents on campus.","Syracuse University suspended all social activities at fraternities for the rest of the year on Sunday, following a string of racist and anti Semitic incidents that have riled students on campus, prompting protests, boycotts and sit ins. Several times this m 923 chars ",2019-11-17T16:58:44Z
Jillian Rayfield and Hiroko Masuike,"Ukraine, Syracuse University, Fred Rogers Your Tuesday Evening Briefing",Heres what you need to know at the end of the day.,"1. I couldnt believe what I was hearing. On the opening day of a packed week of impeachment testimony, two White House aides who were on the July 25 call between President Trump and Ukraines president challenged Mr. Trumps description of the conversation as 380 chars ",2019-11-19T23:11:01Z
Darrell Etherington,The first U.S. clinical trial of using an in brain chip to fight opioid addiction is now underway,"Opioid addiction is easily one of the top widespread healthcare issues facing the U.S., and research indicates were nowhere near achieving any kind of significant mitigating solution. But a team of medical researchers working at the West Virginia University ","Opioid addiction is easily one of the top widespread healthcare issues facing the U.S., and research indicates were nowhere near achieving any kind of significant mitigating solution. But a team of medical researchers working at the West Virginia University 1994 chars ",2019-11-05T16:29:46Z
Zack Whittaker,New 5G flaws can track phone locations and spoof emergency alerts,"5G is faster and more secure than 4G. But new research shows it also has vulnerabilities that could put phone users at risk. Security researchers at Purdue University and the University of Iowa have found close to a dozen vulnerabilities, which they say can b","5G is faster and more secure than 4G. But new research shows it also has vulnerabilities that could put phone users at risk. Security researchers at Purdue University and the University of Iowa have found close to a dozen vulnerabilities, which they say can 3311 chars ",2019-11-12T16:30:14Z
Brendan Hesse,How to Protect Your Smart Speaker From a Laser Attack,"I love a good scientific mysterystuff like quantum weirdness, dark matter and dark energy, strange gravitational behavior, or even why smart speakers respond to light waves as if they were sound. That last one was the topic of a recently published paper from","I love a good scientific mysterystuff like quantum weirdness, dark matter and dark energy, strange gravitational behavior, or even why smart speakers respond to light waves as if they were sound. That last one was the topic of a recently published paper from 3607 chars ",2019-11-05T22:00:00Z
Derrick Bryson Taylor,Missing Clark Atlanta University Student Is Found Dead,"Alexis Crawford was reported missing on Nov. 1, just days after she filed a sexual assault report against her roommates boyfriend, officials said.","Late on Nov. 1, Ms. Crawford was reported missing by her mother and two sisters, who all said they last communicated with her on Oct. 30. Ms. Jones was also interviewed by investigators. She was not on speaking terms with Ms. Crawford because of a separate u 769 chars ",2019-11-09T16:59:13Z
https://www.facebook.com/bbcnews,San Diego State University suspends fraternities after student dies,San Diego State University suspends 14 fraternities after 19 year old Dylan Hernandez's death.,Image copyrightGoFundMeImage caption The death of Dylan Hernandez was confirmed on Monday evening San Diego State University has suspended 14 fraternities following the death of a 19 year old student who had allegedly attended a fraternity event. Dylan He 2297 chars ,2019-11-12T12:53:39Z
"Taylor Romine, CNN",A 112 year old letter was found during renovations at a New Jersey university,"Renovations at Montclair State University in New Jersey uncovered a 112 year old letter from the workers who built one of the original buildings on campus, the university said.",nan,2019-11-30T10:03:07Z
Aaron Randle,"Racial Slurs, and 15 Days That Shook Syracuse",How a protest by students of color at Syracuse University NotAgainSU electrified the campus and gained national attention.,"White fraternity members approached on campus declined to comment on the protests. The Syracuse Intrafraternity Council said it would improve education programs on issues surrounding racism, implicit bias and sexual assault. The Syracuse University community 1432 chars ",2019-11-27T10:00:31Z
Kerry OBrien,Burning Pianos and Whispering Rivers A Composers Journey,"Annea Lockwood, influenced by ecofeminism, will be celebrated at 80 with a Composer Portrait concert at Columbia University.","Ive always thought of rivers as alive, as live phenomena, she said by phone from her current home, in Westchester County, N.Y. It became very clear to me that rivers create their sound by the way they interact with the materials in their banks through frictio 1280 chars ",2019-11-08T17:31:42Z
Billy Witz,"A Good Problem for Stephen F. Austin Distributing 137,000 in Charity",A pastor from the Bahamas and a mid major university must deal with the ramifications of a surprise windfall.,"And thats when the donations began to roll in and in and in. Kara Carpenter, Stephen F. Austins assistant athletic director for compliance, said the school had started a GoFundMe account in September to help Bain raise money for his parents home in a way th 2064 chars ",2019-11-29T22:24:42Z
"Lauren M. Johnson, CNN","Alex Trebek to 'round up' Ottawa University donation, giving his alma mater a cool 10 million","Ottawa University will take donations for 10 million, Alex.",nan,2019-11-14T21:45:13Z
Mike Ives,Your Wednesday Briefing,"Gordon Sondland, Syracuse University, Grammys Here's what you need to know.","In the mid 1950s, the start of the silver age, superheroes rebounded, bolstered by a new Flash Barry Allen, a forensic scientist , a new Hawkman Katar Hol, an alien police detective and others. A twist came in 1961s Flash No. 123, by Gardner Fox and Carmi 927 chars ",2019-11-20T10:34:19Z
https://www.facebook.com/bbcnews,China facial recognition Law professor sues wildlife park,"A university professor is suing a wildlife park for introducing facial recognition, in a landmark case.","Image copyrightAFPImage caption Facial recognition has seen extensive rollout in China A university professor is suing a wildlife park for enforcing facial recognition, in one of the first significant legal challenges to China's rapidly growing use of the 6820 chars ",2019-11-08T09:41:28Z
Mihir Zaveri,14 San Diego State University Fraternities Are Suspended Amid Inquiry Into Students Death,"The circumstances surrounding the 19 year olds death were not immediately released, but the authorities said they were looking into possible misconduct at a fraternity.","The suspension, which was imposed on Friday, is a heavier penalty, essentially a cease and desist, the university said. The fraternities cannot hold activities, participate in university activities or recruit new members pending external review, the universit 1104 chars ",2019-11-12T05:24:09Z
Katie Rogers,"On the Scoreboard The Home Team, the Visitors and Trump","The presidents visit to the University of Alabama, in the thick of an impeachment inquiry, was not without the usual controversy over whether hed be booed or not.","Theyre ruining the game, Mr. Trump told a rally crowd in Alabama in 2017, describing the players protests as a total disrespect of our heritage, and urging team owners to fire them. Even in the White House, professional sports has never been far away. Mr. Tr 2500 chars ",2019-11-09T22:05:06Z
Austin Ramzy,Hong Kong Police End 2 Week Campus Siege,"The police found no protesters during a final search of Polytechnic University, the site of some of the most violent clashes the city has seen this year.","Protesters also set fire to tollbooths near the campus, leading to the two week closure of a major tunnel linking the Kowloon Peninsula with Hong Kong Island. The police said more than 5,800 people had been arrested in connection with the protests since earl 1462 chars ",2019-11-29T06:37:47Z
Megan Specia,London Bridge Attack Victims Were Advocates for Prisoner Rehabilitation,"Saskia Jones and Jack Merritt, who were killed in the attack, had worked with a prison education program backed by Cambridge University.","Jeremy Corbyn, the leader of the opposition Labour Party, told Sky News that he believed that the criminal justice system needed to be reassessed. But he challenged the idea that people sentenced for terrorism offenses should not be released early, and pointe 1021 chars ",2019-12-02T15:11:39Z
Neil Vigdor,Yale Womens Soccer Coach Leaves School Amid Allegations of Sexual Misconduct,The accusations against Brendan Faherty stem from when he coached at the University of New Haven a decade ago.,"We fully support the womens soccer team I am meeting with them to offer resources during this difficult time and I look forward to charting a new path forward together, Ms. Chun said. We know change is hard, but also know the strength and resiliency of our w 1769 chars ",2019-11-22T03:52:00Z
Nicholas Bogel-Burroughs and Hannah Phillips,He Invited Donald Trump Jr. to Campus. Now Hes Facing Impeachment.,The student body president of the University of Florida is under fire for using student fees to host one of President Trumps sons.,"He said he had attended the talk and never viewed it as a campaign event. The drive to oust Mr. Murphy, he said, showed that the opposition party would look for anything to remove the elected president. I think that they have no cigar in both cases, he said. 1537 chars ",2019-11-14T00:19:33Z
Nicholas Bogel-Burroughs,"Our Professors Views Are Vile, University Says. But We Cant Fire Him.",A provost at Indiana University has earned praise for harshly condemning a professors views while respecting the First Amendment.,"On campus on Friday, students were still talking about the controversy, even as many packed up for a week of vacation that runs through Thanksgiving. Selena Drake, a senior studying law and public policy, said she understood that speech needed to be protected 2125 chars ",2019-11-22T23:25:10Z
Eileen Sullivan,Who Is Jonathan Turley Republicans Lone Expert on Impeachment,"A professor at George Washington University Law School, he has represented whistle blowers, members of Congress and terrorism suspects.","Impeachment by its nature, its a political process. What people think is going to happen can turn out to be very different from what happens. Because it has to do with elected officials holding another elected official to account for their conduct. When the f 6488 chars ",2019-12-04T15:31:17Z
https://www.facebook.com/bbcnews,Hong Kong protests Police officer wounded in leg by arrow,Police and anti government protesters are involved in renewed canada education clashes near a university campus.,Image copyrightAFPImage caption The officer was struck close to the Hong Kong Polytechnic University A Hong Kong police officer has been wounded in the leg with an arrow as security forces and anti government protesters engaged in renewed clashes. Images 2823 chars ,2019-11-17T12:48:20Z
https://www.facebook.com/bbcnews,"Election 2019, Your Questions Answered Where should students vote ","Should students vote at home or at university, and more of your questions answered.","Image caption Our question askers clockwise from top left Charlie Evans, Georgie, Josh Payne and Tom Polling day is five weeks away, but you can only confront the big question who do I vote for once you have navigated the basics, such as registerin 5883 chars ",2019-11-07T01:08:26Z
Elaine Yu and Steven Lee Myers,Hong Kong Protests Hundreds Arrested at a University and a Warning from Beijing,About 100 protesters remain holed up inside a besieged college campus.,"Article 158 of the Basic Law does, however, give the congress the final authority over interpreting whether the Basic Law conflicts with national law. It also calls on Hong Kongs Court of Final Appeal to seek the legislatures interpretation in considering cas 1708 chars ",2019-11-19T04:47:35Z
Nick Douglas,Everything You Like Is Propaganda,"A state funded Russian propaganda agency is sowing discord in America through schmaltzy feel good social media accounts, say researchers at Clemson University. These accounts, they claim, share clichd heartwarming and makes you think content that sometim","A state funded Russian propaganda agency is sowing discord in America through schmaltzy feel good social media accounts, say researchers at Clemson University. These accounts, they claim, share clichd heartwarming and makes you think content that sometimes g 4742 chars ",2019-11-27T14:00:00Z
Evan Simko-Bednarski,Gymnast at Southern Connecticut State University dies after a fall in training,"Melanie Coleman, a 20 year old gymnast at Southern Connecticut State University, died Sunday after sustaining an injury while training last Friday."," CNN Melanie Coleman, a 20 year old gymnast at Southern Connecticut State University, died Sunday after sustaining an injury while training last Friday. Ken Sweeten, a spokesperson for Southern Connecticut State, confirmed to CNN Monday that Coleman fell du 1937 chars ",2019-11-12T03:51:55Z
"Rob Frehse and Christina Maxouris, CNN",10 people indicted after investigation into the death of an 18 year old Ohio University fraternity pledge,"Ten people including seven fraternity members were indicted after an investigation into the death of an 18 year old fraternity pledge at Ohio University last year, prosecutors said.",nan,2019-11-20T10:13:45Z
"Amir Vera, CNN",Ohio State's Chase Young returns after 2 game suspension and breaks team's single season sacks record,Ohio State University star defensive end Chase Young broke the school's single season sacks record in his return Saturday after a two game suspension.,nan,2019-11-24T01:06:37Z
,Late night host surprises college students with free tuition,"""Tonight Show"" host Jimmy Fallon surprised three University of Texas students by telling them Samsung would be paying for the remainder of their college tuition.",Chat with us in Facebook Messenger. Find out what's happening in the world as it unfolds.,2019-11-09T11:35:22Z
,112 year old message in bottle found,Renovations at Montclair State University in New Jersey helped uncover a 112 year old letter from workers who built one of the original buildings on campus.,Chat with us in Facebook Messenger. Find out what's happening in the world as it unfolds.,2019-11-29T20:53:48Z
,Football players suspended from team for sharing racist image,"At least four students at the University of Wisconsin Eau Claire have been suspended from the football team, after they shared an image of Klansmen burning a cross.",Chat with us in Facebook Messenger. Find out what's happening in the world as it unfolds.,2019-11-22T06:20:35Z
George Dvorsky,Stingray Shaped Probes Could Explore Venuss Atmosphere,"Researchers with the University at Buffalo are working on a conceptual design that would see a morphing aircraft explore the skies above Venus, including its elusive dark side. Read more...","Researchers with the University at Buffalo are working on a conceptual design that would see a morphing aircraft explore the skies above Venus, including its elusive dark side. Its called BREEZE, or Bio inspired Ray for Extreme Environments and Zonal Explora 3900 chars ",2019-11-11T21:40:00Z
Jonathan Shieber,Coda Biotherapeutics is developing a cure for pain,"If the researchers, executives and investors behind Coda Biotherapeutics have their way, one day soon there really could be a cure for pain. Co founded by researchers Joseph Glorioso, from the University of Pittsburghs microbiology and molecular genetics dep","If the researchers, executives and investors behind Coda Biotherapeutics have their way, one day soon there really could be a cure for pain. Co founded by researchers Joseph Glorioso, from the University of Pittsburghs microbiology and molecular genetics de 4366 chars ",2019-11-05T14:29:50Z
Darrell Etherington,Stingray inspired spacecraft could eventually probe the atmosphere of Venus,"NASAs next Venus probe could be an atmosphere skimming robotic stingray designed by the University of Buffalo. UBs CRASH Lab, which is the institutions Crashworthinesss for Aerospace Structures and Hybrids laboratory, has been selected by NASA to get early","NASAs next Venus probe could be an atmosphere skimming robotic stingray designed by the University of Buffalo. UBs CRASH Lab, which is the institutions Crashworthinesss for Aerospace Structures and Hybrids laboratory, has been selected by NASA to get early 1029 chars ",2019-11-11T16:19:56Z
