author,title,description,content,date
Dirk Meissner,Bones found almost 50 years recognized as B.C.'s first dinosaur species Bowen Island Undercurrent,Bones found almost 50 years recognized as B.C.'s first dinosaur species Bowen Island Undercurrent VIDEO Victoria researcher unveils B.C.s first unique dinosaur discovery Ladysmith Chronicle View full coverage on Google News,"VICTORIA A geologist's discovery of a mysterious claw in rocks along a rail line in British Columbia's northern wilderness almost 50 years ago has led to the recognition of the first dinosaur species unique to the province. Nicknamed Buster, the partial bone 2924 chars ",2019-11-07T11:49:39Z
CBC News,"Prof says more roads, better transit needed in wake of storm that trapped motorists","After many motorists in the Halifax area spent hours stuck in gridlock on roads and highways during the first major snowfall of the year, a Dalhousie University professor says it's time to change how people get in and out of the municipality.","Long lines of cars crawling along the highways and side roads of the Halifax area on Thursday were more the result of poor transportation planning than snowy weather, says a Dalhousie University transportation professor. Some people spent hours in their cars 1404 chars ",2019-11-29T22:36:34Z
Hillary Johnstone,'Back into the closet' LGBTQ seniors face housing discrimination,"Members from Ottawa's LGBTQ community say discrimination causes some people to go ""back into the closet"" during their search for long term seniors housing.","Members of Ottawa's LGBTQ community say discrimination causes some people to go ""back into the closet"" during their search for long term seniors housing. A Halifaxresearcher is holding a focus groupin the capital Tuesdayas part of a Canada wide project fu 1595 chars ",2019-11-12T12:49:00Z
Bangkok Post Public Company Limited,Ruling coalition slammed over shark fin soup,Environmentalists have slammed the government and coalition parties for including shark fin soup on the menu at a get together on Tuesday night.,"Environmentalists have slammed the government and coalition parties for including shark fin soup on the menu at a get together on Tuesday night. In fact, the comments were so sharp that Natural Resources and Environment Minister Varawut Silpa archa had to st 1378 chars ",2019-12-04T13:47:00Z
The Canadian Press,Grocery costs to rise nearly 500 for average Canadian family in 2020,"The average Canadian family will pay up to an extra 487 on feeding themselves next year, according to an annual food price report.","The average Canadian family will spend 12,667 on food at grocery stores and restaurants in 2020. Theyll face nearly 500 in increased grocery costs at the register by years end. Photo Shopping at a food retailer Shutterstock The average Canadian family w 6619 chars ",2019-12-04T14:37:45Z
Emma Davie,"Could old rubbing alcohol be a household hazard That depends, says Dal prof","After Halifax Regional Police blew up a bottle of rubbing alcohol earlier this week, CBC spoke to a Dalhousie chemistry professor about how the chemical could have solidified and how commonly it happens.","A chemistry professor in Halifax says he was surprised to learn that rubbing alcohol had solidified when Halifax Regional Police blew up the expired household chemical on Wednesday. Alex Speed,assistant professor of chemistry at Dalhousie University, said i 4309 chars ",2019-11-24T10:00:00Z
The Canadian Press,"Canadian families will pay nearly 500 more in 2020 for food, report says","The average Canadian family will pay up to an extra 487 for food next year, according to an annual report involving Halifax and Ontario university researchers that highlights climate change as a culprit for rising prices, especially in the produce department.","The average Canadian family will pay up to an extra 487 for food next year, according to an annual report that highlights climate change as a bigculprit for rising prices, especially in the produce department. Unexpected snowstorms, droughts and other weat 5652 chars ",2019-12-04T14:28:35Z
Julia Rodgers,Explained How Justin Trudeau Reshaped the Canadian Political Landscape,"Julia Rodgers Politics, Americas Trudeau is going to have transform his brand into reality in the new minority government. Historically, the Prime Ministers Office PMO has often made decisions in the absence of the opinions of citizens and other legislativ","Historically, the Prime Ministers Office PMO has often made decisions in the absence of the opinions of citizens and other legislative bodies. Since elected in 2015, Justin Trudeaus Liberals have tried to re brand the PMO and extinguish the notion of an ex 5396 chars ",2019-11-13T02:59:00Z
,People with depression experience suicidal thoughts despite treatment, Aarhus University One in five people with depression have suicidal thoughts despite treatment with antidepressants. This is shown by a new study from iPSYCH. The results can be used to examine whether more targeted treatment could be provided for patients,One in five people with depression have suicidal thoughts despite treatment with antidepressants. This is shown by a new study from iPSYCH. The results can be used to examine whether more targeted treatment could be provided for patients where medication does 3591 chars ,2019-11-28T05:00:00Z
John McPhee,"NDP, AIDS coalition push Nova Scotia to cover preventative drug The Journal Pioneer","As a gay man whose community has been devastated by AIDS, Matt Numer obviously wants to see the disease eradicated. But as a scientist, hes intrigued by the way the virus can infiltrate the human body. HIV replicates","As a gay man whose community has been devastated by AIDS, Matt Numer obviously wants to see the disease eradicated. But as a scientist, hes intrigued by the way the virus can infiltrate the human body. HIV replicates by getting into whats called our CD 3990 chars ",2019-12-03T00:47:36Z
The Canadian Press,Former Nova Scotia premier Gerald Regan dead at 91 CTV News,Former Nova Scotia premier Gerald Regan dead at 91 CTV News View full coverage on Google News,"Former Nova Scotia premier Gerald Regan, whose political accomplishments were later overshadowed by a sexual assault trial that resulted in an acquittal, has died at the age of 91. Regan, a lawyer and one time sportscaster, served eight years as the province 5796 chars ",2019-11-27T11:55:00Z
Sherri Borden Colley,"Black women in N.S. less likely to get tested for breast and cervical cancers, study finds","Black women in Nova Scotia are less likely than white women to get mammograms and PAP tests that screen for breast and cervical cancer, a new review out of the University of Toronto has found.","Black women in Nova Scotia are less likely than white women to getmammograms and PAP tests thatscreen for breast and cervical cancer, a new review out of the University of Toronto has found. The study, which waspublished this month in the Journal of Healt 3154 chars ",2019-11-21T10:00:00Z
Hesh Goldstein,"Is eating dead, rotting, stinky flesh safe ","There was an article that appeared in the Asbury Park Press newspaper on October 5, 1919 entitled, Red meat study draws criticism in health field. There was a study done by Bradley Johnson, a professor of Community Health and Epidemiology at Dalhousie Unive","When I was a kid, if I were told that I'd be writing a book about diet and nutrition when I was older, let alone having been doing a health related radio show for over 36 years, I would've thought that whoever told me that was out of their mind. Living in New 9125 chars ",2019-11-19T20:36:31Z
Nicholas Keung - Immigration Reporter,Researchers urge boycott of migration conference slated for China,"As Canada struggles to thaw its frosty relationship with China, academics and researchers are calling for a boycott of the worlds largest conference on migration, settlement and diversity to be held in Beijing next year.","As Canada struggles to thaw its frosty relationship with China, academics and researchers are boycotting the worlds largest conference on migration, settlement and diversity to be held in Beijing. The group has launched an online petition urging that the 20 3813 chars ",2019-11-19T23:14:59Z
Dirk Meissner - The Canadian Press,Bones found almost 50 years ago recognized as B.C.s first dinosaur species,"The partial bones, which included toes, shins and shoulder bones, formed the evidence to designate a new dinosaur species that roamed the province more than 67 million years ago.","VICTORIA A geologists discovery of a mysterious claw in rocks along a rail line in British Columbias northern wilderness almost 50 years ago has led to the recognition of the first dinosaur species unique to the province. Nicknamed Buster, the partial bon 3056 chars ",2019-11-07T13:38:59Z
Emma Smith,'It changes the future' Why this Nova Scotian wants to make brain donation easier,A Lunenburg County woman wants to make it easier for Nova Scotians to donate their brains for research in honour of her dad who had dementia and died a decade ago.,A Lunenburg County woman wants to make it easier for Nova Scotians to donate their brains for research in honour of her dad who had dementia and died a decade ago. Bernice Williams started the nobrainer campaign earlier this month toconvince the provinci 4373 chars ,2019-11-22T10:00:00Z
Bob Weber - The Canadian Press,Climate change shifting protected marine ecosystems outside conservation areas,"Fish species are moving further north because of warming temperatures, which makes accounting for them in marine protected areas difficult.","Governments may have to rethink how they conserve ocean ecosystems as climate change forces marine animals from their usual homes, says newly published research. Things are going to keep changing, said Derek Tittensor of Nova Scotias Dalhousie University, 2906 chars ",2019-11-27T19:49:35Z
Nissim Mannathukkaren,At the altar of national security,"Human development and ecology have always been given the short shrift in India. But now, they are not even discussed","If there is one feature that unites regimes based on right wing ideology across the world, it is their relentless and near daily focus on emotive issues like nationalism, religious identity, terrorism, national security, and so on. While the effect of this in 7404 chars ",2019-11-08T19:06:31Z
Rachel Bergen,Lack of firefighting resources putting south Winnipeggers at risk union,"A large chunk of southern Winnipeg is believed to be at risk because there aren't resources in the area to adequately protect residents from fires, according to the union that represents firefighters in the city.","A large chunk of southern Winnipeg couldbe at risk because there aren't resources in the area to adequately protect residents from fires, warns theunion that represents firefighters in the city. Alex Forrest, the president of the United Fire Fighters of Wi 2859 chars ",2019-11-20T00:37:08Z
Bobbi-Jean MacKinnon,"Don't let New Brunswick become 'lesser' with loss of Brunswick Smelter, urges documentarian",A documentarian and academic from northern New Brunswick says a provincewide discussion about the value of small communities and their future is long overdue.,A documentarian and academic from northern New Brunswick says a provincewide discussion about the value of small communities and their future is long overdue. Tony Tremblaywas reacting to the news Glencore Canada Corp. willclose the Brunswick Smelter in Be 4903 chars ,2019-11-19T09:00:00Z
Emily Chung,Ancient plants learned to survive on land by stealing other species' DNA,"The first plants on Earth were algae that lived in water, and moving onto land required completely new survival skills. Now a new study shows plants got those skills by doing something weird stealing genes from totally different species.","The first plants on Earth were algae that lived in water, and moving onto land required completely new survival skills. Now a new study involving Canadian researchers shows plants got those skillsby stealing genes from a totally different species soil bact 5515 chars ",2019-11-14T18:40:54Z
Paul Withers,"1.8 million pieces of garbage litter bottom of Bay of Fundy, says study","A new study estimates almost two million pieces of junk lie on the seafloor of the Bay of Fundy between Nova Scotia and New Brunwsick, most of which is plastic and fishing gear, but the number is likely more.","A new study estimates almosttwo million pieces of junk lie on the seafloor of the Bay of Fundy between Nova Scotia and New Brunwsick, most of which is plastic and fishing gear, but the number is likely more. The study, Benthic marine debris in the Bay of Fu 3607 chars ",2019-11-15T10:00:00Z
Lauren Strapagiel,This Woman Dropped The Charges Against Her Alleged Rapist And Instead Chose To Confront Him Using Restorative Justice,Marlee Liss now wants other survivors to know that the traditional justice system isnt their only option. View Entire Post ,"The trauma didnt stop when Marlee Liss escaped the condo where she said she was raped. It followed her to the hospital where she had a rape kit examination performed, when she made a report to police, and finally into the courtroom. As she relived it over an 11842 chars ",2019-11-07T16:20:37Z
Paul Withers,Right whale restrictions offer glimpse into future price of climate change,A new report says marine protected areas may not be enough to preserve biodiversity in the face of rapid climate change.,"Protecting ocean ecosystems and marine life from climate change will require more flexibility in the future, including the type of temporary closures imposed by Canada inthe Gulf of St. Lawrence to protect endangered whales, according to a new report. The p 2998 chars ",2019-11-27T19:00:00Z
CBC News,Province reverses course on public private partnerships for 2 Cape Breton hospitals,The Nova Scotia government has quietly reversed its decision to use public private partnerships to build new health care facilities in New Waterford and North Sydney.,"The Nova Scotia government has quietly reversed its decision to use apublic private partnership to buildnew health care facilities in Cape Breton. In April, Transportation and Infrastructure Renewal Minister Lloyd Hines said the model would be used in hosp 2864 chars ",2019-11-07T22:42:28Z
,University of Guelph 2020 Food Price Report Finds Imported Produce Driving Up Canadians' Grocery Bills,"10th annual food forecast announced today GUELPH, ON, Dec. 4, 2019 PRNewswire Canadian families can expect to fork out 487 more on food this year. Rising meat, produce and seafood prices are to blame according to the 2020 Canada's Food Price Report. Rele","The average Canadian household total grocery bill will rise to 12,667. The expected cost increase is the result of meat prices going up by as much as six per cent and produce and seafood prices by about four per cent. ""If U.S. President Donald Trump's ele 2285 chars ",2019-12-04T12:28:00Z
,"2020 DRI Nevada Medal of Science to honor Dr. Kathryn Sullivan, first American woman to walk in space"," Desert Research Institute The Desert Research Institute DRI is pleased to announce the selection of Dr. Kathryn Sullivan, a distinguished scientist, astronaut, explorer and author of 'Handprints on Hubble An Astronaut's Story of Invention' as the recip",IMAGE The DRI Nevada Medal of Science was established by the Desert Research Institute DRI in 1988 to acknowledge outstanding achievement in science and engineering. The award is the highest scientific... view more Credit Desert Research Institute RE 5548 chars ,2019-11-25T05:00:00Z
Cassidy Chisholm,More single people are using New Brunswick food banks,"Nearly half the people using New Brunswick food banks live alone, according to a new report by Food Banks Canada.","Nearly half the people using New Brunswick food banks live alone, according to a new report by Food Banks Canada. ""This is really problematic when you have someone visiting a food bank who lives alone,"" saidSylvain Charlebois,the director of the Agri Food 2580 chars ",2019-11-18T21:00:44Z
"Zane Woodford - Star Halifax,Lyndsay Armstrong - University of Kings College,Megan OToole,Elizabeth McSheffrey - Global News",More than half of Nova Scotians on wells are at risk of having lead in their water,"About 440,000 Nova Scotians nearly half the provinces residents draw tap water from a well.","HALIFAXDarlene Arnold lives in the same home where she grew up, near the ocean in East Jeddore, a fishing village less than an hours drive east of Halifax. Just like about 440,000 other Nova Scotians nearly half the provinces residents the 59 year old 10545 chars ",2019-11-04T10:00:00Z
Aleksandra Sagan - The Canadian Press,"Climate change to push food prices higher, report predicts up to 4 hike in 2020","The average Canadian family will pay up to an extra 487 on feeding themselves next year, according to an annual food price report that highlights climate change as a major culprit for rising food prices, especially in the produce department.","The average Canadian family will pay up to an extra 487 on feeding themselves next year, according to an annual food price report that highlights climate change as a major culprit for rising food prices, especially in the produce department. Unexpected snow 6519 chars ",2019-12-04T05:05:03Z
,Canadians dying at a higher rate in areas with more air pollution," University of British Columbia Air pollution even at levels below national and international air quality guidelines is associated with an increased risk of deaths in Canada, according to new UBC research.","Air pollution even at levels below national and international air quality guidelines is associated with an increased risk of deaths in Canada, according to new UBC research. The study, published today in a Health Effects Institute HEI report, is the la 3488 chars ",2019-11-25T05:00:00Z
,Tanzanian Appointed Acting Chief of CBD," Daily News A TANZANIAN national, Ms Elizabeth Maruma Mrema, has been appointed Acting Executive Secretary of the Convention on Biological Diversity CBD Secretariat based in Monteal, Canada, effective from December 1, this year.","A TANZANIAN national, Ms Elizabeth Maruma Mrema, has been appointed Acting Executive Secretary of the Convention on Biological Diversity CBD Secretariat based in Monteal, Canada, effective from December 1, this year. Ms Mrema's appointment follows the resi 2800 chars ",2019-11-25T11:44:14Z
John Ivison,John Ivison Andrew Scheers future hinges on cross country listening tour,Stepping down would not be an easy decision for Scheer. But he may well come to the conclusion that he has no choice. The discontent is real,"Tom Mulcair was the bookmakers favourite to become prime minister a month before the vote in 2015. Six months after polling day, he was rejected as NDP leader by the majority of delegates at the partys annual convention. Andrew Scheer was in a similar posi 4066 chars ",2019-11-05T23:20:57Z
Brigit Katz,Poor Potato Crops Could Lead to a North American French Fry Shortage,Say it isn't so,"Dreary weather hit North American potato growers hard this fall, leading to dreary news for french fry lovers in the United States and Canada. According to Ashley Robinson of Bloomberg, poor potato crop yields could mean that spud prices will rise this yeara 2771 chars ",2019-12-03T21:01:37Z
Matt C Reynolds,The Faroe Islands Ethnographic Methods in Architecture,Contributed by Matt C Reynolds Source Photo Matt C Reynolds. License All Rights Reserved. This book 77 inch is a reflection of my experience during a solo travel research trip to the Faroe Islands. It was produced over the cou,"This book 77 inch is a reflection of my experience during a solo travel research trip to the Faroe Islands. It was produced over the course of six months, after returning home and processing my extensive notes, drawings, artifacts, and photographs. The ai 572 chars ",2019-11-08T08:11:43Z
,Tanzanian Lands Top UN Position," Citizen Dar es Salaam A Tanzanian, Ms Elizabeth Maruma Mrema, has been appointed acting executive secretary of the Convention on Biological Diversity CBD Secretariat with effect from December 1, 2019.","Dar es Salaam A Tanzanian, Ms Elizabeth Maruma Mrema, has been appointed acting executive secretary of the Convention on Biological Diversity CBD Secretariat with effect from December 1, 2019. CDB is based in Monteal, Canada and the appointment was made 3153 chars ",2019-11-25T11:30:47Z
Josh Rubin - Business Reporter,KFC hopes to avoid a hot mess with new bamboo buckets for poutine,Fast food chain launches a trial of new packagingstarting with poutine.,"Poutine just might be one of the messiest snack foods known to humankind. That also, apparently, makes it the ideal way to test new, environmentally friendly packaging. The gravy and cheese curd laden mass of fries will be front and centre next year as KFC 4342 chars ",2019-11-05T20:21:00Z
Alexander Raginsky,Tenure Track Faculty Positions in Computer Science,The Faculty of Computer Science at Dalhousie University invites applications for a Tenure Stream Assistant Professor position. The ideal candidate for this position would be an outstanding researcher with a de,The Faculty of Computer Science at Dalhousie University invites applications for a Tenure Stream Assistant Professor position. The ideal candidate for this position would be an outstanding researcher with a 2663 chars ,2019-11-07T00:00:00Z
Bob Weber,Canada's protected marine areas may not be protected enough,"Governments may have to rethink how they conserve ocean ecosystems as climate change forces marine animals from their usual homes, says newly published research.","Governments may have to rethink how they conserve ocean ecosystems as climate change forces marine animals from their usual homes, says newly published research. ""Things are going to keep changing,"" said Derek Tittensor of Nova Scotia's Dalhousie University, 2774 chars ",2019-11-28T15:59:56Z
Bob Weber,Canada's marine protected areas may not be protected enough,"Governments may have to rethink how they conserve ocean ecosystems as climate change forces marine animals from their usual homes, says newly published research.","Governments may have to rethink how they conserve ocean ecosystems as climate change forces marine animals from their usual homes, says newly published research. ""Things are going to keep changing,"" said Derek Tittensor of Nova Scotia's Dalhousie University, 2774 chars ",2019-11-28T15:59:56Z
Michael Tutton,Study counts 1.8 million pieces of trash at Bay of Fundy's bottom,"A survey estimates more than 1.8 million pieces of garbage are strewn over the bottom of the Bay of Fundy, prompting concerns about potential harm to marine life.","A survey estimates more than 1.8 million pieces of garbage are strewn over the bottom of the Bay of Fundy, prompting concerns about potential harm to marine life. The study published Thursday in Marine Pollution Bulletin found an average of 137 pieces of pla 3134 chars ",2019-11-16T02:56:01Z
Bob Weber,Threat to fish biodiversity blamed on government scientists,"Canada has made disappointingly little progress in preserving the variety of life in its oceans largely because of a contradiction in the federal department that's supposed to protect it, says a group of senior scientists.","Canada has made disappointingly little progress in preserving the variety of life in its oceans largely because of a contradiction in the federal department that's supposed to protect it, says a group of senior scientists. ""The Department of Fisheries and O 3205 chars ",2019-11-20T21:47:15Z
Sophie Gilbert,The Voices in Margaret Atwoods Head,"Over the course of her writing career, she has given unlikely witnesses the chance to offer personal testimony in times of crisis.","I n 1980, five years before The Handmaids Tale was published, the Canadian writer Margaret Atwood was appearing at a poetry festival in Portland, Oregon, when her trip was disrupted by natural disaster Mount St. Helens, in nearby Washington State, began eru 15295 chars ",2019-11-08T13:00:00Z
Stephen Maher,The people Via Rail is leaving behind,Stephen Maher The Crown corporation's new no cash rule for buying food hurts the 10 per cent of the population that doesn't have a credit card The post The people Via Rail is leaving behind appeared first on Macleans.ca.,"At the end of October, Via Rail announced that it would only accept payment for food and beverages by credit cards and gift cards on most of its routes, which means that people without credit cardsabout 10 per cent of the populationcan no longer buy a coffee 4962 chars ",2019-11-27T21:42:03Z
"Christina Spencer, Ottawa Citizen",Why human rights defenders should skip immigration conference in China,It is time for Canada and other Western countries to recognize they cannot assume that policy and academic exchanges will change repressive regimes.,"The number of international events being hosted by China is on the rise. At first glance, one mightargue that global exchange is a mechanism for the West to normalize democratic values and open science. However, the world is increasingly witnessing repressiv 4185 chars ",2019-11-25T17:10:00Z
,"Genome Editing Services, World Markets to 2030 Focus on CRISPR The Most Popular Genome Manipulation Technology Tool","DUBLIN, Nov. 28, 2019 PRNewswire The ""Genome Editing Services Market Focus on CRISPR 2019 2030"" report has been added to ResearchAndMarkets.com's offering. This report features an extensive study of the current landscape of CRISPR based genome editing se","DUBLIN, Nov. 28, 2019 PRNewswire The ""Genome Editing Services Market Focus on CRISPR 2019 2030"" report has been added to ResearchAndMarkets.com's offering. This report features an extensive study of the current landscape of CRISPR based genome editing s 36112 chars ",2019-11-28T12:00:00Z
